NPO,服務項目,服務對象,網站,電子郵件,聯絡電話,所在縣市,聯絡人
社團法人新竹市脊髓損傷者協會,心理層面之支持、重建、諮商、復康復健、諮詢服務和轉介、社會網絡與倡導、其他,家庭、身心障礙,http://web2.cc.nctu.edu.tw/~hcsci/chinese.htm,hcsci.hcsci@msa.hinet.net,03-5260112,,蘇莉琦
社團法人新竹市自閉症協進會,心理層面之支持、重建、諮商、教育輔導、休閒/體育及文化活動、照顧者支持與訓練、諮詢服務和轉介,社區居民、組織專業、家庭、青少年、兒童、身心障礙,http:www.autism-hsinchu.org.tw/,autismhs@yahoo.com.tw,03-5611095,新竹市,劉琇竹
社團法人新竹縣康復之友協會,日間照顧、生活層面之支持與重建、心理層面之支持、重建、諮商、照顧者支持與訓練、其他,身心障礙,,mind.hsinchu@msa.hinet.net,03-5111041,新竹縣,詹華容
社團法人新竹縣生命線協會,心理層面之支持、重建、諮商、志工培訓、管理、諮詢服務和轉介、自殺防治,疾病患者、勞工、社區居民、組織專業、老人、婦女、青少年、兒童,https://www.unitedway.org.tw/%E7%84%A1,mail.life@msa.hinet.net,03-5100588,新竹縣,蔡西湖
社團法人普濟門慈善會,,,http://www.pgm.org.tw,pgm.p9999@yahoo.com.tw,08-7702003,屏東縣,王璽榜
社團法人桃園市自閉症協進會,心理層面之支持、重建、諮商、就業服務、照顧者支持與訓練、諮詢服務和轉介、社會網絡與倡導,身心障礙,http://kidsstar.org.tw/,kids.star@msa.hinet.net,03-3386117分機0,桃園市,曹湘怡
社團法人桃園縣助人專業促進協會,,,http://www.help.org.tw,lu391031@gmail.com,03-3359532,桃園縣,呂淑蘭
社團法人桃園縣失智症關懷協會,,,https://www.unitedway.org.tw/%E7%84%A1,socialwork254@gmail.com,03-4531844,桃園縣,林佩詩
社團法人桃園縣康復之友協會,日間照顧、生活層面之支持與重建、家屬或照顧者支持與訓練、就業準備及訓練、諮詢服務,身心障礙,http://www.typr.org.tw,yulifeng@cht.com.tw,03-4627920,桃園縣,游麗鳳
社團法人桃園縣智障者家長協會,到宅服務、休閒/體育及文化活動、就業服務、照顧者支持與訓練、諮詢服務和轉介,身心障礙,http://www.mrp.org.tw,pap.mhty@msa.hinet.net,03-3699135,桃園縣,郭慧玲
社團法人桃園縣社區精神復健協會,生活層面之支持與重建、復康復健、志工培訓、管理、照顧者支持與訓練,身心障礙,http://www.tcpr.com.tw,lanping@kimo.com,03-3683320,桃園縣,馬蘭萍
社團法人桃園縣聲暉協進會,生活層面之支持與重建、心理層面之支持、重建、諮商、就業服務、照顧者支持與訓練、諮詢服務和轉介,家庭、身心障礙,http://www.soundshine.org.tw,sound.t28@msa.hinet.net,03-2841540,桃園縣,許桂芬
社團法人桃園縣聾啞福利協進會,就業輔導、社會教育、推廣教育、權益倡導、親職教育、資訊提供、宣導防治、關懷訪視、其他,身心障礙,http://www.tydfa.org,lin58_0302@yahoo.com.tw,03-3314198,桃園市,
社團法人桃園縣脊髓損傷者協會,心理層面之支持、重建、諮商、家屬或照顧者支持與訓練、休閒/體育及文化活動、諮詢服務、社會宣導,家庭、身心障礙,http://tw.myblog.yahoo.com/taoyuan_tsci/,taoyuan.tsci@msa.hinet.net,03-4025022,桃園縣,彭意驊
社團法人桃園縣視障輔導協會,到宅服務、就業服務、職前準備及訓練、諮詢服務和轉介、其他,身心障礙,http://www.hearteye.com5.tw,tyhvisa86921@yahoo.com.tw,03-3476473,桃園縣,胡怡惠
社團法人澎湖縣彩繪人生協會,,,https://www.unitedway.org.tw/%E7%84%A1,chps4215@yahoo.com.tw,06-9262965,澎湖縣,吳銘宜
社團法人澎湖縣智障者家長協會,職業訓練、就業輔導、日間照顧、其他,,,Ramr@ms23.hinet.net,06-9263739,澎湖縣,高金蘭
社團法人澎湖縣照顧服務協會,生活層面之支持與重建、社區居住/照顧、輔助科技及無障礙環境協助、就業服務、社會宣導,老人、身心障礙,http://www.phcs.artcom.tw/ap/index.aspx,paimia1014@yahoo.com.tw,06-9276422,澎湖縣,蔡軒眉(已離職)
社團法人真善美協會,生活層面之支持與重建、心理層面之支持、重建、諮商、保護管束與更生保護、教育輔導、休閒/體育及文化活動,其他、藥酒毒癮者、受刑人、社區居民、原住民、家庭、老人、婦女、青少年、兒童、身心障礙,http://jsm.no-ip.info/,rainbow.center@msa.hinet.net,04-25884578,台中市,徐會宜
社團法人臺中市和平區健康促進推廣協會,疾病或藥酒毒癮服務、志工培訓、管理、諮詢服務和轉介、自殺防治、其他,藥酒毒癮者、社區居民、原住民、家庭、老人、青少年,https://www.unitedway.org.tw/%E7%84%A1,meifeng.jan@gmail.com,04-25941887,台中市,詹美鳳
社團法人臺中市山海屯啟智協會,其他,身心障礙,http://www.lovhrt659.org.tw/,lovhrt.t659@msa.hinet.net,04-25242603,台中市,林貴樹
社團法人臺中市山海屯國際生命線協會,心理層面之支持、重建、諮商、志工培訓、管理,受刑人、疾病患者、勞工、社區居民、家庭、老人、婦女、青少年、兒童,http://www.life999.org.tw,t1158728@ms26.hinet.net,04-25150905,台中市,邱方昱
社團法人臺中市線上家教促進協會,,,http://www.aaot.tw,service@aaot.tw,04-23022055,台中市,王昱今
社團法人臺北市雙胞胎協會,生活層面之支持與重建、心理層面之支持、重建、諮商、教育輔導、諮詢服務、社會宣導,社區居民、原住民、組織專業、婦女、青少年、兒童、身心障礙,http://www.taipeitwins.org/ch/,neighboradd@yahoo.com.tw,02-23974812,台北市,張亞薇
社團法人臺北縣志願服務協會,職業訓練、就業輔導、醫療協助、社會教育、推廣教育、收容安置、日間照顧、經濟扶助、志願服務、專業訓練、緊急庇護、送餐服務、資訊提供、宣導防治、緊急生活重建、關懷訪視,藥酒毒癮者、疾病患者、遊民、社區居民、家庭、老人、青少年、兒童,http://www.vtc.org.tw/front/bin/ptdetail.phtml?Part=intro100,f2725082@ms65.hinet.net,02-2272-5082,新北市,郭鈺涵
社團法人臺北縣板橋市親子服務協會,生活層面之支持與重建、教育輔導、就業準備及訓練、社區營造/文化產業、志工培訓、管理,其他、藥酒毒癮者、疾病患者、遊民、勞工、社區居民、原住民、組織專業、家庭、老人、婦女、青少年、兒童、身心障礙,http://220.tw-link.com,rinder8995@yahoo.com.tw,02-89523559,新北市,柯杏枝
社團法人臺北縣鶯歌鎮青少年教育關懷協會,生活層面之支持與重建、家屬或照顧者支持與訓練、教育輔導、休閒/體育及文化活動、志工培訓、管理,原住民、家庭、青少年,http://www.ygedu.org/,viky0827@pchome.com.tw,-02-26791074,新北市,林芯怡
社團法人臺南市佳田社區關懷協會,,,https://www.unitedway.org.tw/ga6881826%40gmail.com,ga6881826@gmail.com,06-6881826,台南市,林美純
社團法人臺南市南區國宅社區發展協會,,,http://sixstar.moc.gov.tw/blog/B0013/communityAction.do?method=doCommunityView,a1014886@ms79.hinet.net,06-2631259,台南市,李金雀
社團法人臺南市新營區民榮社區發展協會,,,http://sixstar.moc.gov.tw/frontsite_new/general/dispatch.do?def=frontsite_new.ge...,house.ys666@msa.hinet.net,06-6322249,台南市,林忠信
社團法人臺東縣智障者家長協會,心理層面之支持、重建、諮商、休閒/體育及文化活動、志工培訓、管理、照顧者支持與訓練、諮詢服務和轉介,家庭、身心障礙,http://www.pmhp.org.tw/ap/index.aspx,ttpa.ttpa@msa.hinet.net,08-9238668,台東縣,許惠雅
社團法人臺東縣自閉症協進會,,,http://www.ttaa.org.tw/ap/index.aspx,ttaa1001129@yahoo.com.tw,08-9342330,台東縣,蕭郁珍
社團法人臺灣公共衛生促進協會,,,http://www.phlib.org.tw,phlibphlib@gmail.com,06-2757928,台南市,陳慈立
社團法人臺灣圓愛全人關懷協會,生活層面之支持與重建、心理層面之支持、重建、諮商、教育輔導、住宿式照顧、諮詢服務,家庭、青少年,https://www.unitedway.org.tw///blog.udn.com/agapelove,a0952366931@yahoo.com.tw,04-22056797,台中市,翁寶釵
社團法人臺灣酒駕防制社會關懷協會,,,http://www.tadd.org.tw,taddtaiwan@gmail.com,02-23931676,台北市,陳姵澐
社團法人花蓮縣兒童暨家庭關懷協會,,,http://www.hcfa.url.tw,hualien.family@gmail.com,03-8563020,花蓮縣,嚴育涵
社團法人花蓮縣原住民族產業整合暨社會服務協會,,,https://www.unitedway.org.tw/%E7%84%A1,Wu.jungyi@gmail.com,03-8521373,花蓮縣,吳榮一
社團法人花蓮縣啄木鳥全人發展協會,,,https://zh-tw.facebook.com/pages/%E7%A4%BE%E5%9C%98%E6%B3%95%E4%BA%BA%E8%8A%B1%E...,naynaylin0201@gmail.com,03-8731235,花蓮縣,林慧蕓
社團法人花蓮縣喜樂關懷協會,生活層面之支持與重建、心理層面之支持、重建、諮商、教育輔導、休閒/體育及文化活動、志工培訓、管理,其他、老人、婦女、青少年、兒童,http://www.houseofjoy.org.tw,joy3405@gmail.com,03-8663405,花蓮縣,梅慧敏
社團法人花蓮縣大比大家庭關懷協會,生活層面之支持與重建、心理層面之支持、重建、諮商、社區居住/照顧、志工培訓、管理、諮詢服務和轉介,原住民、家庭、婦女、青少年、兒童,http://tw.myblog.yahoo.com/hu_tabitha/archive?l=a,sunday00426@yahoo.com.tw,03-8324996,花蓮縣,蕭馥如
社團法人花蓮縣幸福協會,,,https://www.unitedway.org.tw/%E7%84%A1,hunaggina@gmail.com,03-8661077,花蓮縣,黃瓊芬
社團法人花蓮縣康復之友協會,生活層面之支持與重建、心理層面之支持、重建、諮商、就業服務、志工培訓、管理、照顧者支持與訓練,疾病患者、社區居民、家庭、身心障礙,https://www.unitedway.org.tw/%E7%84%A1,hualien_kangfu@yahoo.com.tw,03-8310787,花蓮縣,葉而珊
社團法人花蓮縣持修積善協會,,,https://www.unitedway.org.tw/61.219.59.77/,anja6511@hotmail.com,03-8354611,花蓮縣,李貞慧
社團法人花蓮縣新象社區交流協會,教育輔導、休閒/體育及文化活動、社區營造/文化產業、照顧者支持與訓練、諮詢服務和轉介,社區居民、原住民、家庭、婦女、青少年、兒童,https://www.unitedway.org.tw/%E7%84%A1,lin771011@hotmail.com,03-8352335,花蓮縣,林佳儀
社團法人花蓮縣智障福利協進會,休閒/體育及文化活動、就業服務、照顧者支持與訓練、諮詢服務和轉介、社會網絡與倡導,家庭、身心障礙,,hualien.ml@msa.hinet.net,03-8237756,花蓮縣,莊智聖
社團法人花蓮縣牛犁社區交流協會,生活層面之支持與重建、心理層面之支持、重建、諮商、教育輔導、社區營造/文化產業、性別及婚姻支持服務,勞工、社區居民、原住民、組織專業、家庭、老人、婦女、青少年、兒童、身心障礙,http://www.nlica.org.tw,e7968@yahoo.com.tw,03-8650243,花蓮縣,游雅帆
社團法人花蓮縣生命線協會,心理層面之支持、重建、諮商、志工培訓、管理、自殺防治,其他、受刑人、組織專業、婦女、兒童、身心障礙,http://www.hllife.tw/,service@hllife.tw,03-8362995,花蓮縣,林彥華
社團法人花蓮縣老人暨家庭關懷協會,生活層面之支持與重建、心理層面之支持、重建、諮商、到宅服務、志工培訓、管理、其他,社區居民、家庭、老人、婦女、兒童、身心障礙,http://www.hlof.artcom.tw,hl.ef486@msa.hinet.net,03-8330522,花蓮縣,陳景婷
社團法人花蓮縣聽障協進會,職業訓練、就業輔導、權益倡導、專業訓練、其他,,,Shim6038@kimo.com.tw,03-8227083,花蓮縣,韓征蘭
社團法人花蓮縣角石生命發展協會,社會教育、推廣教育、權益倡導、輔導諮商、自殺防治、早期療育、志願服務、托育服務、親職教育,婦女、青少年、兒童、身心障礙,,Peter77.ken77@msa.hinet.net,03-8311733,花蓮縣,謝素美
社團法人苗栗縣康復之友協會,日間照顧、心理層面之支持、重建、諮商、疾病或藥酒毒癮服務,藥酒毒癮者、社區居民、身心障礙,http://www.mlmra.org.tw,,03-7676811,苗栗縣,劉鴻翠
社團法人苗栗縣愛加倍社區關懷協會,臨時托育服務-非身障者、臨時及短期照顧-身障者、教育輔導、社區居住/照顧、志工培訓、管理,社區居民、原住民、家庭、老人、婦女、青少年、兒童、身心障礙,http://www.godloveyou.org.tw,timy.chan@msa.hinet.net,03-7760765,苗栗縣,張天苗
社團法人苗栗縣智障福利協進會,生活層面之支持與重建、到宅服務、諮詢服務和轉介,身心障礙,http://www.malysos.org.tw/ap/index.aspx,maly.sos@msa.hinet.net,03-7368611,苗栗縣,林素珠
社團法人苗栗縣生命線協會,專業訓練、心理層面之支持、重建、諮商、教育輔導、志工培訓、管理、自殺防治,其他、社區居民、家庭、青少年、兒童,http://www.1995life.com.tw,asdf.life@msa.hinet.net,03-7362110,苗栗縣,孫保珍
社團法人苗栗縣聲暉協進會,職業訓練、就業輔導、社會教育、推廣教育、社區發展、權益倡導、早期療育、志願服務、輔具服務、親職教育、宣導防治、關懷訪視,家庭、兒童、身心障礙,,mlhear.aid103@msa.hinet.net,03-7275336,苗栗縣,蘇雯娟
社團法人苗栗縣脊髓損傷者協會,生活層面之支持與重建、復康復健、到宅服務、輔助科技及無障礙環境協助、諮詢服務和轉介,其他、身心障礙,http://www.moil168.artcom.tw/ap/index.aspex,moil168.moil168@msa.hinet.net,03-7482838,苗栗縣,蔡沛華
社團法人苗栗縣自閉症協進會,生活層面之支持與重建、家屬或照顧者支持與訓練、教育輔導、休閒/體育及文化活動、社會宣導,家庭、身心障礙,http://www.autism-miaoli.org.tw,autism.mli@msa.hinet.net,03-7475604,苗栗縣,鄭素蓉
社團法人苗栗縣視覺障礙者福利協進會,生活層面之支持與重建、心理層面之支持、重建、諮商、休閒/體育及文化活動、就業準備及訓練、社會宣導,身心障礙,,color8421@yahoo.com.tw,03-7279631,苗栗縣,徐韻琪
社團法人苗栗縣身心障礙燭光技能發展協會,醫療協助、社會教育、推廣教育、資訊提供、關懷訪視,社區居民、身心障礙,http://www.mllight.org.tw,chen.go1688@msa.hinet.net,03-7615662,苗栗縣,古諭澄
社團法人苗栗縣身心障礙福利協進會,就業輔導、醫療協助、社會教育、推廣教育、社區發展、志願服務、親職教育、康樂休閒、宣導防治、關懷訪視,身心障礙,http://www.aa630273.bexweb.tw,aa630273@yahoo.com.tw,03-7614482,苗栗縣,劉正康
社團法人苗栗縣銀髮族照顧協會,,,https://www.unitedway.org.tw/%E7%84%A1,silvergroupcare@gmail.com,03-7638962,苗栗縣,黃瓊玉
社團法人金門縣婦女權益促進會,就業輔導、權益倡導、安親課輔、法律諮詢、關懷訪視、其他,婦女,http://kmwm.womenweb.org.tw/,t334166@yahoo.com.tw,08-2334166,金門縣,許淑蓉
社團法人金門縣康復之友協會,心理層面之支持、重建、諮商、就業服務、諮詢服務和轉介、其他,身心障礙,http://www.psy.org.tw,kmkf2013@gmail.com,08-2334380,金門縣,李芸霈
社團法人金門縣身心障礙福利協進會,生活層面之支持與重建、家屬或照顧者支持與訓練、輔助科技及無障礙環境協助、就業準備及訓練、諮詢服務,身心障礙,http://www.cakca.bexweb.tw,LoveKinmen520@gmail.com,-08-2330765,金門縣,陳佳玲
社團法人金門縣身心障礙者家長協會,生活層面之支持與重建、家屬或照顧者支持與訓練、輔助科技及無障礙環境協助、就業服務,家庭、身心障礙,,ace020304@yahoo.com.tw,08-2337393,金門縣,陳月娥
社團法人雲林縣勞工福利保護協會,就業服務、職前準備及訓練、諮詢服務和轉介、社會網絡與倡導、其他,勞工、家庭、婦女,http://tw.myblog.yahoo.com/labor-welfare/,weimaxkimo@yahoo.com.tw,05-5223173分機0,雲林縣,沈宜萱
社團法人雲林縣台西身心障礙者福利協會,生活層面之支持與重建、臨時及短期照顧-身障者、到宅服務、就業服務、諮詢服務和轉介,社區居民、家庭、身心障礙,http://ytpmdma.pixnet.net/blog,tai.hsi@hotmail.com,05-6981790,雲林縣,吳燕芬
社團法人雲林縣啟智協會,日間照顧、專業訓練、到宅服務、社會宣導,身心障礙,http://www.yaomrp.org.tw,yaomrp@ms33.hinet.net，ylsummer@so-net.net.tw,05-5571311,雲林縣,李東蒼
社團法人雲林縣康復之友協會,職業訓練、就業輔導、社會教育、推廣教育、輔導諮商、自殺防治、志願服務、問安服務、康樂休閒、資訊提供、宣導防治、關懷訪視,身心障礙,https://www.unitedway.org.tw/%E7%84%A1,r05280@ms58.hinet.net,0918-091-590（林海清理事長手機）,,吳佳齡
社團法人雲林縣復健青年協進會,日間照顧、生活層面之支持與重建、到宅服務、就業服務、諮詢服務和轉介,老人、身心障礙,http://home.way@msa.hinet.net,sweet6805@yahoo.com.tw,05-5341940,雲林縣,楊淑蘭
社團法人雲林縣照顧服務發展協會,社會教育、推廣教育、在宅服務、居家照顧、社區發展、權益倡導、志願服務、安親課輔、親職教育、送餐服務、問安服務、康樂休閒、關懷訪視、健康維護,社區居民、老人、兒童,,a7720708@yahoo.com.tw,05-7990046,雲林縣,吳國良
社團法人雲林縣生命線協會,心理層面之支持、重建、諮商、教育輔導、志工培訓、管理、諮詢服務和轉介、自殺防治,其他,http://www.yunlin-lff.bexweb.tw/,Yunlin.lff@msa.hinet.net,05-5351995,雲林縣,林宥家
社團法人雲林縣百里香兒童青少年關懷協會,生活層面之支持與重建、心理層面之支持、重建、諮商、教育輔導、諮詢服務和轉介,社區居民、家庭、青少年、兒童,https://www.unitedway.org.tw/%E7%84%A1,my_thyme@yahoo.com.tw,05-5373652,雲林縣,邱翠萍
社團法人雲林縣盲人褔利協進會,就業輔導、權益倡導、志願服務、輔具服務、問安服務、康樂休閒、資訊提供、宣導防治、關懷訪視、健康維護、其他,身心障礙,,xing.xing825@msa.hinet.net,05-6961212,雲林縣,許雅瑩
社團法人雲林縣社會關懷協會,職業訓練、就業輔導、權益倡導、志願服務、專業訓練、親職教育、問安服務、康樂休閒、資訊提供、法律諮詢、宣導防治、關懷訪視,勞工、組織專業、家庭、婦女、青少年、兒童,,tsyrauey@ms46.hinet.net,05-5516683分機01,雲林縣,賴惠華
社團法人雲林縣老人福利保護協會,心理層面之支持、重建、諮商、到宅服務、其他,社區居民、老人、身心障礙,http://www.carefamily.org.tw,oldmman@ms33.hinet.net,05-5519878,雲林縣,賴婉淑
社團法人雲林縣老人長期照護協會,日間照顧、專業訓練、家屬或照顧者支持與訓練、到宅服務、志工培訓、管理,社區居民、老人、身心障礙,http://www.careold.org.tw,careold@ms63.hinet.net,-05-5372198,雲林縣,陳玲穎
社團法人雲林縣耕心家庭協會,生活層面之支持與重建、心理層面之支持、重建、諮商、復康復健、社區居住/照顧,家庭、老人,,w560118@yahoo.com.tw,05-5576235,雲林縣,吳台琳
社團法人雲林縣聲暉協進會,心理層面之支持、重建、諮商、就業服務、照顧者支持與訓練、諮詢服務和轉介、社會網絡與倡導,家庭、身心障礙,http://www.yunlinsound.org.tw/,yunlin.sond@msa.hinet.net,05-5978517,雲林縣,江雯雅
社團法人雲林縣聽語障福利協進會,專業訓練、生活層面之支持與重建、就業服務、志工培訓、管理,社區居民、身心障礙,http://yhsi.org.tw/,hsiyounlin@ms93.url.com.tw,05-5972639,雲林縣,鍾欣育
社團法人雲林縣脊髓損傷者協會,生活層面之支持與重建、心理層面之支持、重建、諮商、休閒/體育及文化活動,身心障礙,http://www.ylsci.org.tw/,yunlin.sciorg@msa.hinet.net,05-5266837,雲林縣,張瑞蘭
社團法人雲林縣虎尾殘障福利協會,日間照顧、生活層面之支持與重建、臨時及短期照顧-身障者、就業服務、社會宣導,身心障礙,,Huwei6226072@yahoo.com.tw,05-6332675,雲林縣,高雅慧
社團法人雲林縣視障重建福利協進會,專業訓練、生活層面之支持與重建、心理層面之支持、重建、諮商、休閒/體育及文化活動、就業準備及訓練,身心障礙,,qwerty8212@yahoo.com.tw,05-5321966,雲林縣,洪孝先
社團法人雲林縣身心障礙者重建協會,,,http://linker.tw/hope/,hopeful.mail@msa.hinet.net,05-5973551,雲林縣,侯迦玲
社團法人高雄三山脊損重建協會,生活層面之支持與重建、心理層面之支持、重建、諮商、社區居住/照顧、輔助科技及無障礙環境協助、其他,身心障礙,http://www.kscsci.org.tw,threebulls@ymail.com,07-719-1039,高雄市,陳益龍
社團法人高雄市一葉蘭同心會,心理層面之支持、重建、諮商、休閒/體育及文化活動、就業準備及訓練、諮詢服務、志工培訓、管理,其他,http://www.kmoa.org.tw/,kmoa@ymail.com,07-2361811,高雄市,賴佳惠
社團法人高雄市三民區安泰社區發展協會,日間照顧、生活層面之支持與重建、到宅服務、休閒/體育及文化活動、志工培訓、管理,其他、社區居民、家庭、老人、婦女、青少年、兒童、身心障礙,http://npo0055.npo.nat.gov.tw/,antai269@yahoo.com.tw,07-3239699,高雄市,張芳淑
社團法人高雄市亞鐳慈善會,心理層面之支持、重建、諮商、教育輔導、志工培訓、管理、諮詢服務和轉介、其他,其他、遊民、勞工、社區居民、原住民、家庭、老人、身心障礙,http://www.yalei.org.tw/,yalei8686@yahoo.com.tw,07-5561665,高雄市,戴鏜縉
社團法人高雄市仁武慈暉志願協會,,,https://www.unitedway.org.tw/%E7%84%A1,3759727@gmail.com,07-3759727,高雄市,湛月菊
社團法人高雄市佛光腎臟關懷協會,,,http://www.kidneycare.org.tw,kidneysociety@yahoo.com.tw,07-5530270,高雄市,李美春
社團法人高雄市佳音社區營造協會,,,https://www.unitedway.org.tw/baksa1868%40yahoo.com.tw,kaim9708@yahoo.com.tw,07-6681139,高雄市,蕭巧玲
社團法人高雄市傷殘服務協會,,,http://www.home.kimo.com.tw/disable2,disabled2368602@yahoo.com.tw,07-2368602,高雄市,劉春連
社團法人高雄市兒童青少年曙光協會,社會教育、推廣教育,青少年、兒童,,grace_center@yahoo.com.tw,07-3652987,高雄市,張獻憶
社團法人高雄市十點十分生命關懷協會,,,https://www.unitedway.org.tw/%E7%84%A1,peiwei805@yahoo.com.tw,07-5713806,高雄市,黃培偉
社團法人高雄市唇顎裂顱顏協會,心理層面之支持、重建、諮商、教育輔導、志工培訓、管理、諮詢服務和轉介、社會網絡與倡導,社區居民、家庭、青少年、兒童、身心障礙,https://www.unitedway.org.tw/tw.myblog.yahoo.com/jw%212XAiciKZExGn_%EF%BC%8C%20h...,kcfa2003@yahoo.com.tw,07-2369163,高雄市,葉晃瑞
社團法人高雄市啟智協進會,到宅服務、就業服務、志工培訓、管理、職前準備及訓練、諮詢服務和轉介,身心障礙,http://www.kamr.org.tw,Xz064109@ispeed.com.tw,07-3330718,高雄市,曾月娥
社團法人高雄市基督教福氣教會,休閒/體育及文化活動、諮詢服務和轉介,社區居民、家庭、青少年、兒童,http://www.blessing.com.tw/,jameschien0711@gmail.com,07-3451919分機20,高雄市,馮珮
社團法人高雄市基督教豐收協會,心理層面之支持、重建、諮商、教育輔導、志工培訓、管理,社區居民、家庭、婦女、青少年、兒童,https://www.unitedway.org.tw/%E7%84%A1,miyi1016@hotmail.com,07-3101404,高雄市,黃敏儀
社團法人高雄市多元家庭關愛協會,,,https://www.unitedway.org.tw/%E7%84%A1,women_38word@yahoo.com.tw,07-6960456,高雄市,廖瑞玲
社團法人高雄市大崗山康復之友協會,心理層面之支持、重建、諮商、休閒/體育及文化活動、就業服務、照顧者支持與訓練、諮詢服務和轉介,社區居民、家庭、青少年、身心障礙,,kbt_gangshan@so-net.net.tw,07-6221263,高雄市,曾盈薰
社團法人高雄市大高雄生命線協會,心理層面之支持、重建、諮商、志工培訓、管理、性別及婚姻支持服務、諮詢服務和轉介、自殺防治,其他、社區居民、組織專業、青少年,http://kp1995.lokan.com.tw/,kp1995.ks@msa.hinet.net,07-6245995,高雄市,葛姵瑩
社團法人高雄市天主教加大博愛協會,專業訓練、心理層面之支持、重建、諮商、教育輔導、志工培訓、管理、諮詢服務和轉介,其他、社區居民、組織專業、家庭、老人、婦女、青少年、兒童、身心障礙,http://ppt.cc/d6l-,sky326613@yahoo.com.tw,07-2254363,高雄市,邱怡玲
社團法人高雄市天晴女性願景協會,生活層面之支持與重建、心理層面之支持、重建、諮商、就業服務、志工培訓、管理、性別及婚姻支持服務,社區居民、老人、婦女,http://ktcwwa.womenweb.org.tw,tcwwa950108@gmail.com,07-3229588,高雄市,梁淑英
社團法人高雄市失智症協會,教育輔導、志工培訓、管理、照顧者支持與訓練、諮詢服務和轉介、其他,其他、疾病患者、社區居民、組織專業、老人,http://www.kda.org.tw,kda20060930@gmail.com,07-3134752,高雄市,龔達瑋
