NPO,服務項目,服務對象,網站,電子郵件,聯絡電話,所在縣市,聯絡人
財團法人台灣基督長老教會眉溪教會,日間照顧,老人,,cili.awi@msa.hinet.net,49.292015,南投縣,詹春花
財團法人台灣基督長老教會蒙恩教會,社會教育、推廣教育、社區發展、輔導諮商、自殺防治、志願服務、問安服務、康樂休閒、緊急生活重建、關懷訪視,其他、社區居民、家庭、老人、青少年、兒童,,mongan.church@msa.hinet.net,04-23800015,台中市,傅世賢
財團法人台灣基督長老教會附設身心障礙關懷中心,就業輔導、社會教育、推廣教育、日間照顧、權益倡導、志願服務、專業訓練、親職教育、資訊提供、關懷訪視、其他,社區居民、組織專業、家庭、兒童、身心障礙,http://dacc.org.tw,dacc.org@msa.hinet.net,07-9697800,高雄市,張藝馨
財團法人台灣痲瘋救濟基金會,生活層面之支持與重建、心理層面之支持、重建、諮商、社區居住/照顧,疾病患者、身心障礙,https://www.unitedway.org.tw/http%EF%BC%9Awww.tlra.org.tw/,elliotkuo@gmail.com,02-25429529,台北市,郭怡綾
財團法人台灣癌症基金會,心理層面之支持、重建、諮商、疾病或藥酒毒癮服務、志工培訓、管理、諮詢服務和轉介、社會網絡與倡導,疾病患者、社區居民、組織專業,http://www.canceraway.org.tw,shelley@canceraway.org.tw,02-87879907分機205,台北市,葉淑玲
財團法人台灣省台中縣霧峰光復基督教會,職業訓練、問安服務、自殺防治/心理衛生、保護管束與更生保護、社區居住/照顧、諮詢服務、社會宣導,受刑人、社區居民、家庭、老人、婦女、青少年、兒童,,kf.church@msa.hinet.net,04-23300901,台中市,王彥惠
財團法人台灣省台南市天主教仁愛修女會附設台南市私立老吾老養護中心,醫療協助、收容安置、日間照顧、在宅服務、居家照顧、專業訓練、關懷訪視,疾病患者、老人、身心障礙,https://www.unitedway.org.tw/%E7%84%A1,dc.hospic@msa.hinet.net,8-7897128,台南市,林宜慧
財團法人台灣省台南市天主教鮑思高慈幼會附設屏東縣私立少年城,教育輔導、其他,青少年、兒童,https://www.unitedway.org.tw/%E7%84%A1,cw1249pt009205@yahoo.com.tw,08-7882245分機0,屏東縣,張 淑真
財團法人台灣省天主教會新竹教區苗栗縣私立聖家啟智中心,職業訓練、日間照顧、在宅服務、居家照顧、早期療育、托育服務、安親課輔、親職教育、資訊提供、關懷訪視,家庭、兒童、身心障礙,http://www.hfhc.org.tw,hfhc.a101@msa.hinet.net,03-7460142,苗栗縣,張桂蓮
財團法人台灣省天主教會新竹教區附設德蘭兒童中心,醫療協助、收容安置、輔導諮商、自殺防治、志願服務、親職教育、關懷訪視、健康維護,青少年、兒童,http://www.catholic.org.tw/teresa,ma11261@ms10.hinet.net,-,新竹縣,林佩君
財團法人台灣省天主教會新竹教區附設新竹縣私立長安老人養護中心,專業訓練、到宅服務、住宿服務、照顧者支持與訓練,社區居民、老人,http://www.changan-an.org.tw,changan.sw@msa.hinet.net,03-5943987分機1162,新竹縣,陳世勳
財團法人台灣省天主教會新竹教區附設桃園縣私立天使發展中心,日間照顧、到宅服務、諮詢服務和轉介、其他,身心障礙,https://www.unitedway.org.tw/http//www%20ty-angel%20.org.tw,taoyuan.angel@msa.hinet.net,-03-3675235104,桃園縣,吳晏慈社工
財團法人台灣省天主教會新竹教區附設桃園縣私立愛家發展中心,就業輔導、醫療協助、收容安置、日間照顧、親職教育、其他,身心障礙,http://www.catholic.org.tw/aijia/,lovefamily_tw@yahoo.com.tw,03-4388284,桃園縣,王悅
財團法人台灣省天主教會新竹教區附設邊緣青少年服務中心,生活層面之支持與重建、心理層面之支持、重建、諮商、志工培訓、管理、性別及婚姻支持服務、其他,其他、組織專業,http://www.catholic.org.tw/youth91/index,youth_sos@yahoo.com.tw,03-5240161,新竹市,江美慶
財團法人台灣省山地基督教長老教會靜觀教會,安親課輔,,http://truku.disciple.com.tw,micuo@ms67.hinet.net,049-2970102,南投縣,簡光雄
財團法人台灣省私立健順養護中心,日間照顧、專業訓練、志工培訓、管理、住宿服務、諮詢服務和轉介,其他、老人,http://tw.myblog.yahoo.com/jianshuncenter,d6622499@ms26.hinet.net,02-26622499分機103,新北市,陳淑敏
財團法人台灣省私立台灣盲人重建院,生活層面之支持與重建、心理層面之支持、重建、諮商,身心障礙,http://www.ibt.org.tw/,2008bike@ibt.org.tw,02-29985588分機122,新北市,高新&#21894;
財團法人台灣省私立向上社會福利基金會,日間照顧、生活層面之支持與重建、復康復健、社區居住/照顧、住宿服務,組織專業、青少年、兒童、身心障礙,http://www.child-home.org.tw,show05288@yahoo.com.tw,04-23727170分機211,台中市,陳秀美
財團法人台灣省私立向上社會福利基金會附屬台中光音育幼院,生活層面之支持與重建、心理層面之支持、重建、諮商、教育輔導、住宿式照顧、諮詢服務,青少年、兒童,http://www.child-home.org.tw,child.home@msa.hinet.net,-04-22034455202,台中市,劉倖君
財團法人台灣省私立向上社會福利基金會附屬台中育嬰院,臨時及短期照顧-身障者、住宿式照顧、諮詢服務、社會宣導,兒童、身心障礙,http://www.child-home.org.tw,babies.home@msa.hinet.net,04-23727170211,台中市,陳秀美
財團法人台灣省私立啟智技藝訓練中心,職業訓練、就業輔導、收容安置、社區發展、權益倡導、專業訓練、親職教育、宣導防治,身心障礙,http://www.vtcmr.org,art0912@ms24.hinet.net,03-4617912,桃園縣,張兆遠
財團法人台灣省私立嘉義博愛仁愛之家,臨時托育服務-非身障者、臨時及短期照顧-身障者、照顧者支持與訓練、諮詢服務和轉介、社會網絡與倡導,遊民、老人、身心障礙,https://www.unitedway.org.tw/%E7%84%A1,chiayi_old@yahoo.com.tw,05-2762306分機106,嘉義市,周湘瑤
財團法人台灣省私立心德慈化教養院,職業訓練、收容安置、安養服務、社區發展、經濟扶助、權益倡導、輔導諮商、自殺防治、早期療育、專業訓練、緊急庇護,,http://home.pchome.com.tw/net/sin-te,sin-te@pchome.com.tw,06-6581816,台南市,王玉雪
財團法人台灣省私立毓得社會福利基金會,日間照顧、專業訓練、生活層面之支持與重建、心理層面之支持、重建、諮商、志工培訓、管理,其他、家庭、老人、兒童、身心障礙,http://www.yude.org.tw/,ec.tw@msa.hinet.net,04-22803998分機16,台中市,林坤義
財團法人台灣省苗栗縣公館教會聚會所附設青少年服務中心,就業輔導、社會教育、推廣教育、社區發展、權益倡導、輔導諮商、自殺防治、志願服務、專業訓練、親職教育、康樂休閒、更生保護、宣導防治、關懷訪視、其他,受刑人、社區居民、原住民、組織專業、家庭、青少年、兒童、身心障礙,,annahuangkao@yahoo.com.tw,03-7234973,苗栗縣,林書賦
財團法人台灣省香園紀念教養院,職業訓練、就業輔導、收容安置、日間照顧、早期療育、托育服務、親職教育,,http://myweb.hinet.net/homel/j785571/index.htm,g0953561@yahoo.com.tw,(03)5690951,新竹縣,李封寓
財團法人台灣紅絲帶基金會,生活層面之支持與重建、疾病或藥酒毒癮服務、教育輔導、志工培訓、管理、諮詢服務和轉介,其他、藥酒毒癮者、疾病患者、勞工、青少年,http://www.taiwanaids.org.tw,sandy@taiwanaids.org.tw,02-25592059分機17,台北市,金家玉
財團法人台灣聖公會--基隆聖三一堂,生活層面之支持與重建、心理層面之支持、重建、諮商、教育輔導、休閒/體育及文化活動、其他,家庭、婦女、青少年、兒童,http://www.wretch.cc/blog/a3100000,a3100000@gmail.com,02-24659909,基隆市,李瑞強
財團法人台灣聖公會牧愛堂,心理層面之支持、重建、諮商、疾病或藥酒毒癮服務、到宅服務、休閒/體育及文化活動、諮詢服務和轉介,老人、身心障礙,http://www.goodshepherd.com.tw,swmail86@gmail.com,02-28816317,台北市,吳嘉凌
財團法人台灣肯納自閉症基金會,日間照顧、生活層面之支持與重建、心理層面之支持、重建、諮商、社區居住/照顧、職前準備及訓練,身心障礙,http://www.kanner.org.tw/,kanner_taiwan@yahoo.com.tw,02-28741699,台北市,張浩
財團法人台灣醫療改革基金會,社會教育、推廣教育、權益倡導、資訊提供、宣導防治、健康維護,其他、疾病患者、社區居民、組織專業,http://www.thrf.org.tw/,thrf@seed.net.tw,02-27091329分機17,台北市,張雅婷
財團法人吉祥臻社會福利事業基金會,臨時托育服務-非身障者、社區居住/照顧、志工培訓、管理、其他,社區居民、家庭、青少年、兒童,http://www.chc.org.tw,chc9111@yahoo.com.tw,07-5815152分機16,高雄市,黃鈺棠
財團法人呂旭立紀念文教基金會,專業訓練、心理層面之支持、重建、諮商、性別及婚姻支持服務、諮詢服務和轉介、自殺防治,其他、疾病患者、社區居民、組織專業、家庭、婦女、青少年、兒童,http://www.shiuhli.org.tw,yuhanchen@shiuhli.org.tw,02-23635939,台北市,范曉玫
財團法人周大觀文教基金會,社會教育、推廣教育、經濟扶助、權益倡導、輔導諮商、自殺防治、志願服務、緊急庇護、安親課輔、資訊提供、法律諮詢、更生保護、宣導防治、關懷訪視、健康維護,其他、受刑人、燒燙傷患者、疾病患者、原住民、青少年、兒童、身心障礙,http://www.ta.org.tw,ta88@ms17.hinet.net,02-2917877011,新北市,孫心怡 秘書長
財團法人善慧恩社會慈善基金會,,,http://www.gwg.org.tw,gwg.org.tw@gmail.com,07-9745999,高雄市,羅汶欣
財團法人喜憨兒社會福利基金會,日間照顧、臨時及短期照顧-身障者、社區居住/照顧、就業準備及訓練、就業服務,身心障礙,http://www.c-are-us.org.tw,t00499@careus.org.tw,07-7266096分機21,高雄市,陳惠美
財團法人喜憨兒社會福利基金會附設台北市私立喜憨兒社區照顧中心,職業訓練、就業輔導、社會教育、推廣教育、日間照顧、權益倡導、志願服務、其他,身心障礙,http://www.c-are-us.org.tw,careust@ms34.hinet.net,2325-7383,台北市,王姵方
財團法人喜憨兒社會福利基金會附設新竹市私立喜憨兒中心,職業訓練、就業輔導、社會教育、推廣教育、日間照顧、專業訓練、托育服務、親職教育、康樂休閒、資訊提供、關懷訪視,身心障礙,http://www.careus.org.tw,fran1195@careus.org.tw,03-6563071,新竹縣,林意倫
財團法人喜憨兒社會福利基金會附設高雄市私立紫羅蘭園,緊急庇護、其他,身心障礙,http://www.c-are-us.org.tw,careus@ms2.hinet.net,07-3959449,高雄市,廖玉琢
財團法人喜憨兒社會福利金會附設社區照護中心-玫瑰園,職業訓練、就業輔導、社會教育、推廣教育、權益倡導、輔導諮商、自殺防治,社區居民、家庭、身心障礙,http://www.c-are-us.org.tw,careus@careus.org.tw,07-7266096,高雄市,廖玉琢
財團法人嘉義縣私立天主教敏道社會福利慈善事業基金會,生活層面之支持與重建、復康復健、社區營造/文化產業、諮詢服務和轉介,其他、身心障礙,http://tw.myblog.yahoo.com/mindao-2009/,mindao.s5968@msa.hinet.net,05-3625968,嘉義縣,唐子晉
財團法人國際單親兒童文教基金會,就業輔導、社會教育、推廣教育、經濟扶助、權益倡導、專業訓練、親職教育、資訊提供、法律諮詢、關懷訪視、其他,其他、組織專業、家庭、婦女、青少年、兒童,http://www.spef.womenweb.org.tw,spef@ms24.hinet.net,02-2552-7888,台北市,王惠敏
財團法人基督教台中更生團契,生活層面之支持與重建、保護管束與更生保護、疾病或藥酒毒癮服務、就業服務、志工培訓、管理,其他、受刑人、家庭、兒童,http://www.pftaichung.org,pftaichung999@gmail.com,04-26651790,台中市,陳怡蒨
財團法人基督教台灣信義會,,,http://srcscd.pixnet.net/blog,glc.moses@gmail.com,02-86717485分機18,新北市,衛行光
財團法人基督教基隆靈糧堂,,,https://www.unitedway.org.tw/epage.klllc.org.tw%20%28%E5%A7%94%E5%A4%96%E5%BB%BA...,hsiang0210@gmail.com,02-24212036,基隆市,項春香
財團法人基督教宇宙光全人關懷機構,專業訓練、心理層面之支持、重建、諮商、自殺防治/心理衛生、諮詢服務、志工培訓、管理,受刑人、社區居民、組織專業、家庭、青少年、兒童,http://www.cosmiccare.org,mercy@cosmiccare.org,02-23632107分機140,台北市,謝麗雪
財團法人基督教救世軍,生活層面之支持與重建、心理層面之支持、重建、諮商、就業服務,遊民、婦女、青少年、兒童,https://www.unitedway.org.tw/%E7%84%A1,Daniel_Chen@taw.salvationarmy.org.tw,02-25520536,台北市,陳忠良
財團法人基督教更生團契,心理層面之支持、重建、諮商、保護管束與更生保護、志工培訓、管理,受刑人、家庭、老人、婦女、青少年、兒童,http://pf.twn@msa.hinet.net,s5152.s0614@msa.hinet.net,02-25368846分機14,台北市,林瑛珠
財團法人基督教更生團契台南區會,就業輔導、社會教育、推廣教育、輔導諮商、自殺防治、專業訓練、更生保護、藥酒癮戒除,藥酒毒癮者、受刑人、青少年、兒童,http://church.chhs.com.tw/cl,John.yau@msa.hinet.tw,06-2268648,台南市,姚榮輝
財團法人基督教更生團契彰化區會,就業輔導、志願服務、其他,,,Baf520ch@ms58.hinet.tw,04-8758779.04-8743083,彰化縣,陳寶蓮
財團法人基督教更生團契附設花蓮縣私立信望愛少年學園,收容安置、更生保護、其他,,http://www.PFTaiwan.org.tw,fhl.academy@msa.hinet.net,〈03〉8700046,花蓮縣,林芹羽
財團法人基督教浸信會,生活層面之支持與重建、心理層面之支持、重建、諮商、自殺防治/心理衛生、性別及婚姻輔導、教育輔導,藥酒毒癮者、疾病患者、勞工、社區居民、原住民、組織專業、家庭、老人、婦女、青少年、兒童、身心障礙,https://www.unitedway.org.tw/%E7%84%A1,chinmingwu@yahoo.com.tw,05-5322238,雲林縣,吳津銘
財團法人基督教芥菜種會,心理層面之支持、重建、諮商、保護管束與更生保護、教育輔導、休閒/體育及文化活動,其他、社區居民、老人、青少年、兒童,http://www.mustard.org.tw/index.asp,su.sw.agape@mustard.org.tw,02-25974868分機123,台北市,陳曉真
財團法人基督教芥菜種會附設台北縣私立愛心育幼院,收容安置,青少年、兒童,,kids.home@msa.hinet.net,02-2992-7503,新北市,蔣玉真
財團法人基督教芥菜種會附設私立花蓮少年之家,職業訓練、就業輔導、收容安置、輔導諮商、自殺防治、志願服務、專業訓練、親職教育、康樂休閒、關懷訪視、其他,組織專業、家庭、青少年、兒童,,ms1954@ms67.hinet.net,03-8562343,花蓮縣,金宜萱
財團法人天下雜誌教育基金會,,,http://www.lcenter.com.tw,,02-25078627,台北市,張嘉軒
財團法人天主教主顧修女會,職業訓練、社會教育、推廣教育、在宅服務、居家照顧、志願服務、送餐服務、問安服務、資訊提供、關懷訪視,老人,https://www.unitedway.org.tw/%E8%AB%8B%E5%A1%AB%E7%B6%B2%E5%9D%80,jane6907@ms62.hinet.net,,新北市,郭瑞真
財團法人天主教伯利恆文教基金會承辦台南縣北區嬰幼兒發展中心,日間照顧、其他,家庭、兒童、身心障礙,http://www.bethlehem.org.tw,bethlehe@ms32.hinet.net,06-78304556分機103,台南市,林香利
財團法人天主教光仁社會福利基金會,日間照顧、社區居住/照顧、就業準備及訓練、社會宣導,其他、身心障礙,http://www.kjswf.org.tw,service.kjswf.org.tw,-02-27363988,台北市,原慧心
財團法人天主教光仁社會福利基金會附設台北市私立育仁啟智中心,在宅服務、居家照顧、早期療育,家庭、兒童、身心障礙,http://www.kjswf.org.tw,ju.rn@msa.hinet.net,2307-8393,台北市,何明昱
財團法人天主教光仁社會福利基金會附設育仁啟能中心,職業訓練,身心障礙,,yujen108@yahoo.com.tw,23821090,台北市,王淑惠
財團法人天主教善牧社會福利基金會,生活層面之支持與重建、心理層面之支持、重建、諮商、志工培訓、管理、社會網絡與倡導、其他,其他、原住民、婦女、青少年、兒童,http://www.goodshepherd.org.tw,sisters@goodshepherd.org.tw,02-23815402分機271,台北市,湯靜蓮
財團法人天主教善牧社會福利基金會(附設信心家園),,,http://www.goodshepherd.org.tw,sisters@ms9.hinet.net,(03)9224-254,台北市,林美珊
財團法人天主教善牧社會福利基金會家庭服務中心,就業輔導、法律諮詢、其他,青少年,http://www.goodshepherd.org.tw,sisters@ms9.hinet.net,02-2381-5402,台北市,林美珊
財團法人天主教善牧社會福利基金會附設兒童心理諮商中心,安親課輔、親職教育、康樂休閒、宣導防治,兒童,http://www.goodshepherd.org.tw,sisters@ms9.hinet.net,02-2381-5402,台北市,林美珊
財團法人天主教善牧社會福利基金會附設台中市親心家園,社會教育、推廣教育、收容安置、社區發展、緊急庇護、法律諮詢、宣導防治、緊急生活重建,,http://www.goodshepherd.org.tw,sisters@ms9.hinet.net,02-23815402,台北市,林美珊
財團法人天主教善牧社會福利基金會附設台北善牧學園,社會教育、推廣教育、宣導防治,其他、青少年,http://www.goodshepherd.org.tw,sisters@ms9.hinet.net,02-23088300,台北市,胡玉娟
財團法人天主教善牧社會福利基金會附設德心之家,,,http://www.goodshepherd.org.tw,sisters@ms9.hinet.net,02-23815402,台北市,林美珊
財團法人天主教善牧社會福利基金會附設德莉之家,就業輔導、收容安置、緊急庇護、法律諮詢,青少年,http://www.goodshepherd.org.tw,sisters@ms9.hinet.net,02-23815402,台北市,林美珊
財團法人天主教善牧社會福利基金會附設德蓮之家,就業輔導、收容安置、緊急庇護、法律諮詢,青少年,http://www.goodshepherd.org.tw,sisters@ms9.hinet.net,02-23815402,台北市,林美珊
財團法人天主教善牧社會福利基金會附設萬華少年服務中心,就業輔導、社會教育、推廣教育、社區發展、志願服務、康樂休閒、宣導防治、關懷訪視、其他,青少年,http://www.goodshepherd.org.tw,sisters@ms9.hinet.net,02-2381-5402,台北市,林美珊
財團法人天主教失智老人社會福利基金會,家屬或照顧者支持與訓練、住宿式照顧、諮詢服務、社會宣導、志工培訓、管理,疾病患者、社區居民、組織專業、家庭、老人、身心障礙,http://www.cfad.org.tw,winson.tcl@gmail.com,02-23320992分機112,台北市,曾家琳
財團法人天主教失智老人社會福利基金會附設台北市私立聖若瑟失智老人養護中心,收容安置、日間照顧、權益倡導、志願服務、專業訓練,老人、身心障礙,http://www.cfad.org.tw,s8910009@ms61.hinet.net,23046602,台北市,王宜雯
財團法人天主教康泰醫療教育基金會,專業訓練、生活層面之支持與重建、心理層面之支持、重建、諮商、照顧者支持與訓練、其他,疾病患者、組織專業、家庭、老人、婦女、青少年、兒童,http://www.kungtai.org.tw/,health@kungtai.org.tw,02-23657780分機12,台北市,那姍姍
財團法人天主教曉明社會福利基金會,日間照顧、專業訓練、性別及婚姻輔導、到宅服務、諮詢服務,社區居民、組織專業、老人、婦女、身心障礙,http://www.lkk.org.tw,tiffany.myday@msa.hinet.net,04-22974225分機112,台中市,王婉如
財團法人天主教會台中教區原住民總鐸區,社會教育、推廣教育、收容安置、社區發展、經濟扶助、權益倡導、輔導諮商、自殺防治、志願服務、安親課輔、康樂休閒、資訊提供、宣導防治、緊急生活重建、關懷訪視,疾病患者、勞工、社區居民、原住民、家庭、老人、婦女、青少年、兒童,,Lovi.sari@msa.hinet.net,049-2741163,台中市,田振明
財團法人天主教會台中教區附設南投縣私立復活啟智中心,職業訓練、日間照顧、臨時及短期照顧-身障者、休閒/體育及文化活動、職前準備及訓練,身心障礙,,littlelushih@hotmail.com,04-92927717,南投縣,施&#32137;華
財團法人天主教會台中教區附設南投縣私立玫瑰啟能訓練中心,日間照顧、臨時及短期照顧-身障者、諮詢服務、其他,身心障礙,http://www.holyrosary.org.tw,rose_632411@hotmail.com,04-92632411,南投縣,陳美君
財團法人天主教會台中教區附設台中市私立慈愛智能發展中心,日間照顧、臨時及短期照顧-身障者、諮詢服務、社會宣導、住宿服務,身心障礙,http://www.catholic.org.tw/tszai213/,tsz.ai213@msa.hinet.net,04-22962127,台中市,陳宏仁
財團法人天主教會台中教區附設彰化縣私立聖家啟智中心,日間照顧、臨時及短期照顧-身障者、到宅服務、諮詢服務,兒童、身心障礙,http://santa.casa@msa.hinet.net,santa.casa@msa.hinet.net,04-8374936,彰化縣,黃祉瑜
財團法人天主教會台中教區附設彰化縣私立聖智啟智中心,日間照顧、臨時及短期照顧-身障者、到宅服務,兒童、身心障礙,,shenq.jyh@msa.hinet.net,04-8893730,彰化縣,李佳霖
財團法人天主教會台中教區附設彰化縣私立聖母聖心啟智中心,社會教育、推廣教育、日間照顧、在宅服務、居家照顧、早期療育、托育服務、安親課輔、親職教育、資訊提供、關懷訪視,社區居民、家庭、兒童、身心障礙,http://www.catholic.org.tw/heart,heart.l772085@msa.hinet.net,04-7712743,彰化縣,林家儂
財團法人天主教會台中教區附設臺灣省私立慈愛殘障教養院,日間照顧、臨時及短期照顧-身障者、到宅服務、就業服務、住宿服務,身心障礙,http://www.tszai.org.tw,tszai@ms38.hinet.net,04-7124891分機6103,彰化縣,蘇宜平
財團法人天主教會台北教區,社會教育、推廣教育、志願服務、問安服務、資訊提供、其他,社區居民、組織專業、家庭、老人,http://www.elders.org.tw,socialcch@yahoo.com.tw,(02)2219-3391 分機67151或66207,新北市,周苡榛
財團法人天主教會台北教區附設活泉身心靈整合中心,社會教育、推廣教育、社區發展、輔導諮商、自殺防治、專業訓練、親職教育、資訊提供、宣導防治、健康維護,社區居民、組織專業、家庭、婦女、青少年、兒童,http://fountain.netartisan.org,hwo.chyuan@msa.hinet.net,02-23821885,台北市,邱加利
財團法人天主教會嘉義教區附設嘉義縣私立聖心教養院,社區居住/照顧、志工培訓、管理、住宿服務,身心障礙,http://sacheart.sino1.com.tw/,sacheart@ms51.hinet.net,05-3795465分機124,嘉義縣,王仁杏
財團法人天主教會花蓮教區,就業輔導、社會教育、推廣教育、在宅服務、居家照顧、社區發展、經濟扶助、權益倡導、輔導諮商、自殺防治、志願服務、緊急庇護、安親課輔、親職教育、資訊提供、法律諮詢、宣導防治、關懷訪視、其他,其他、社區居民、原住民、家庭、老人、婦女、青少年、兒童,http://www.catholic.org.tw/hualien/,fuliwomen@yahoo.com.tw,03-8830622,花蓮縣,于君玉
財團法人天主教會花蓮教區-成功鎮原住民家庭暨服務中心,生活層面之支持與重建、心理層面之支持、重建、諮商、教育輔導,身心障礙,,l83101855@yahoo.com.tw,08-9852190,台東縣,李秀美
財團法人天主教會花蓮教區富里鄉原住民家庭暨婦女服務中心,心理層面之支持、重建、諮商、臨時托育服務-非身障者、到宅服務、志工培訓、管理、性別及婚姻支持服務,其他、疾病患者、勞工、社區居民、原住民、組織專業、家庭、老人、婦女、青少年、兒童、身心障礙,http://tw.myblog.yahoo.com/jw!9YbS9I.UBRueT3eUDgjYiXwR,fulicenter@yahoo.com.tw,03-8830487,花蓮縣,李秀霞
財團法人天主教會花蓮教區秀林鄉原住民家庭暨婦女服務中心,就業輔導、社會教育、推廣教育、社區發展、經濟扶助、權益倡導、輔導諮商、自殺防治、早期療育、志願服務、專業訓練、托育服務、安親課輔、親職教育、問安服務、康樂休閒、資訊提供、法律諮詢、宣導防治、緊急生活重建、關懷訪視、健康維護、其他,疾病患者、社區居民、原住民、家庭、老人、婦女、青少年、兒童、身心障礙,http://www.catholic.org.tw/hualien,ching_chung3816@yahoo.com.tw；huacuria@ms6.hinet.net,03-8611285,花蓮縣,朱慶忠， 林少梅
財團法人天主教會花蓮教區附設救星教養院,日間照顧、復康復健、到宅服務、住宿服務、照顧者支持與訓練,身心障礙,http://www.star.org.tw,az0828@ms59.hinet.net,08-9359284,台東縣,劉詩嫈
財團法人天主教會花蓮教區附設花蓮縣私立聲遠老人養護之家,社區居住/照顧、住宿服務,社區居民、原住民、老人、兒童,,lostpontoon@gmail.com,03-8610075分機102,花蓮縣,黃佩瑩
